{
 "id": "arena",
 "spawn": [0, 0.01, 0],
 "killY": -40,
 "waveDelay": 5,
 "base": {"pos": [0, 0, 0], "radius": 5, "regenPerSecond": 25},
 "enemySpawns": [
  {"type":"enemy.thug","pos":[5,0.01,8]},
  {"type":"enemy.thug","pos":[-5,0.01,12]},
  {"type":"enemy.thug","pos":[0,0.01,18]}
 ],
 "colliders": [
  {"kind":"ground","min":[-120,-2,-120],"max":[120,0,120]},
  {"kind":"building","min":[-41,0,-41],"max":[-31,8,-31]},
  {"kind":"building","min":[-41,0,-17],"max":[-31,23,-7]},
  {"kind":"building","min":[-41,0,7],"max":[-31,8,17]},
  {"kind":"building","min":[-41,0,31],"max":[-31,23,41]},
  {"kind":"building","min":[-17,0,-41],"max":[-7,33,-31]},
  {"kind":"building","min":[-17,0,-17],"max":[-7,23,-7]},
  {"kind":"building","min":[-17,0,7],"max":[-7,13,17]},
  {"kind":"building","min":[-17,0,31],"max":[-7,33,41]},
  {"kind":"building","min":[7,0,-41],"max":[17,28,-31]},
  {"kind":"building","min":[7,0,-17],"max":[17,23,-7]},
  {"kind":"building","min":[7,0,7],"max":[17,18,17]},
  {"kind":"building","min":[7,0,31],"max":[17,13,41]},
  {"kind":"building","min":[31,0,-41],"max":[41,23,-31]},
  {"kind":"building","min":[31,0,-17],"max":[41,23,-7]},
  {"kind":"building","min":[31,0,7],"max":[41,23,17]},
  {"kind":"building","min":[31,0,31],"max":[41,23,41]},
  {"kind":"crate","min":[6,0,-2],"max":[8,1.2,2]},
  {"kind":"crate","min":[8,0,-2],"max":[10,2.4,2]},
  {"kind":"crate","min":[10,0,-2],"max":[12,3.5999999999999996,2]},
  {"kind":"crate","min":[12,0,-2],"max":[14,4.8,2]},
  {"kind":"building","min":[56,0,56],"max":[68,58,68]},
  {"kind":"building","min":[-68,0,56],"max":[-56,66,68]},
  {"kind":"building","min":[56,0,-68],"max":[68,50,-56]},
  {"kind":"building","min":[-68,0,-68],"max":[-56,72,-56]},
  {"kind":"building","min":[-67,0,-5],"max":[-57,28,5]},
  {"kind":"building","min":[57,0,-5],"max":[67,36,5]},
  {"kind":"building","min":[-5,0,57],"max":[5,30,67]},
  {"kind":"building","min":[-5,0,-67],"max":[5,24,-57]},
  {"kind":"building","min":[-35,0,57],"max":[-25,40,67]},
  {"kind":"building","min":[25,0,-67],"max":[35,44,-57]},
  {"kind":"crate","min":[-9,0,-7],"max":[-7,1.2,-5]},
  {"kind":"crate","min":[-11,0,-7],"max":[-9,1.2,-5]},
  {"kind":"crate","min":[-10,0,-9],"max":[-8,1.2,-7]},
  {"kind":"wall","min":[-7,0,-14],"max":[7,4.5,-12.5],"breakable":1},
  {"kind":"wall","min":[-14,0,-7],"max":[-12.5,4.5,7],"breakable":1},
  {"kind":"wall","min":[-7,0,-20],"max":[7,5.5,-18.5],"breakable":2}
 ]
}
