{
  "id": "tutorial",
  "name": "Brightport Training Grounds",
  "theme": {
    "sky": [
      0.55,
      0.78,
      0.95
    ],
    "ground": [
      0.5,
      0.78,
      0.5
    ],
    "buildings": [
      [
        0.93,
        0.45,
        0.45
      ],
      [
        0.4,
        0.62,
        0.95
      ],
      [
        0.98,
        0.78,
        0.35
      ],
      [
        0.62,
        0.5,
        0.9
      ]
    ]
  },
  "spawn": [
    0,
    0.01,
    -35
  ],
  "killY": -40,
  "waveDelay": 5,
  "base": {
    "pos": [
      0,
      0,
      -35
    ],
    "radius": 5,
    "regenPerSecond": 25
  },
  "enemySpawns": [],
  "props": [
    {
      "type": "prop.car",
      "pos": [
        6,
        0,
        0
      ]
    },
    {
      "type": "prop.crate",
      "pos": [
        -6,
        0,
        -4
      ]
    },
    {
      "type": "prop.dumpster",
      "pos": [
        -7,
        0,
        20
      ]
    }
  ],
  "colliders": [
    {
      "kind": "ground",
      "min": [
        -70,
        -2,
        -70
      ],
      "max": [
        70,
        0,
        70
      ]
    },
    {
      "kind": "building",
      "min": [
        -23.0,
        0,
        -13.0
      ],
      "max": [
        -13.0,
        14,
        -3.0
      ]
    },
    {
      "kind": "building",
      "min": [
        -23.0,
        0,
        7.0
      ],
      "max": [
        -13.0,
        13,
        17.0
      ]
    },
    {
      "kind": "building",
      "min": [
        -23.0,
        0,
        25.0
      ],
      "max": [
        -13.0,
        10,
        35.0
      ]
    },
    {
      "kind": "building",
      "min": [
        13.0,
        0,
        -13.0
      ],
      "max": [
        23.0,
        14,
        -3.0
      ]
    },
    {
      "kind": "building",
      "min": [
        13.0,
        0,
        7.0
      ],
      "max": [
        23.0,
        13,
        17.0
      ]
    },
    {
      "kind": "building",
      "min": [
        13.0,
        0,
        25.0
      ],
      "max": [
        23.0,
        10,
        35.0
      ]
    },
    {
      "kind": "wall",
      "min": [
        -4,
        0,
        10
      ],
      "max": [
        4,
        5,
        11.5
      ],
      "breakable": 1
    },
    {
      "kind": "crate",
      "min": [
        8,
        0,
        -14
      ],
      "max": [
        10,
        2,
        -12
      ]
    }
  ]
}
