{
  "id": "finale",
  "name": "The Shard Engine",
  "theme": {
    "sky": [
      0.28,
      0.2,
      0.42
    ],
    "ground": [
      0.4,
      0.34,
      0.5
    ],
    "buildings": [
      [
        0.55,
        0.35,
        0.8
      ],
      [
        0.4,
        0.3,
        0.7
      ],
      [
        0.7,
        0.4,
        0.85
      ]
    ]
  },
  "spawn": [
    0,
    0.01,
    -44
  ],
  "killY": -40,
  "waveDelay": 5,
  "base": {
    "pos": [
      0,
      0,
      -44
    ],
    "radius": 5,
    "regenPerSecond": 25
  },
  "enemySpawns": [],
  "props": [
    {
      "type": "prop.dumpster",
      "pos": [
        7.8,
        0,
        13.5
      ]
    },
    {
      "type": "prop.car",
      "pos": [
        15.6,
        0,
        0.0
      ]
    },
    {
      "type": "prop.car",
      "pos": [
        7.8,
        0,
        -13.5
      ]
    },
    {
      "type": "prop.dumpster",
      "pos": [
        -7.8,
        0,
        -13.5
      ]
    },
    {
      "type": "prop.car",
      "pos": [
        -15.6,
        0,
        -0.0
      ]
    },
    {
      "type": "prop.car",
      "pos": [
        -7.8,
        0,
        13.5
      ]
    }
  ],
  "colliders": [
    {
      "kind": "ground",
      "min": [
        -72,
        -2,
        -72
      ],
      "max": [
        72,
        0,
        72
      ]
    },
    {
      "kind": "building",
      "min": [
        -2.0,
        0,
        26.6
      ],
      "max": [
        2.0,
        14,
        30.6
      ]
    },
    {
      "kind": "building",
      "min": [
        14.8,
        0,
        21.1
      ],
      "max": [
        18.8,
        14,
        25.1
      ]
    },
    {
      "kind": "building",
      "min": [
        25.2,
        0,
        6.800000000000001
      ],
      "max": [
        29.2,
        14,
        10.8
      ]
    },
    {
      "kind": "building",
      "min": [
        25.2,
        0,
        -10.8
      ],
      "max": [
        29.2,
        14,
        -6.800000000000001
      ]
    },
    {
      "kind": "building",
      "min": [
        14.8,
        0,
        -25.1
      ],
      "max": [
        18.8,
        14,
        -21.1
      ]
    },
    {
      "kind": "building",
      "min": [
        -2.0,
        0,
        -30.6
      ],
      "max": [
        2.0,
        14,
        -26.6
      ]
    },
    {
      "kind": "building",
      "min": [
        -18.8,
        0,
        -25.1
      ],
      "max": [
        -14.8,
        14,
        -21.1
      ]
    },
    {
      "kind": "building",
      "min": [
        -29.2,
        0,
        -10.8
      ],
      "max": [
        -25.2,
        14,
        -6.800000000000001
      ]
    },
    {
      "kind": "building",
      "min": [
        -29.2,
        0,
        6.800000000000001
      ],
      "max": [
        -25.2,
        14,
        10.8
      ]
    },
    {
      "kind": "building",
      "min": [
        -18.8,
        0,
        21.1
      ],
      "max": [
        -14.8,
        14,
        25.1
      ]
    }
  ]
}
